{
  "schemaVersion": 1,
  "submittedAtUnix": 1784560684,
  "tool": {
    "name": "llmfit",
    "version": "1.1.3"
  },
  "hardware": {
    "hwClass": "DISCRETE_GPU",
    "hardwareName": "NVIDIA GeForce RTX 2080",
    "memTierGb": 8,
    "vramGb": 8.0,
    "gpuCount": 1,
    "unifiedMemory": false,
    "cpu": "Intel(R) Core(TM) i9-10900X CPU @ 3.70GHz",
    "cpuCores": 20,
    "ramGb": 62.49,
    "os": "linux"
  },
  "results": [
    {
      "model": "gpt-oss-20b-MXFP4.gguf",
      "provider": "llamacpp",
      "numRuns": 3,
      "avgTps": 36.35,
      "minTps": 28.95,
      "maxTps": 40.54,
      "avgTtftMs": null,
      "avgTotalMs": 7125.59,
      "avgOutputTokens": 247.67
    },
    {
      "model": "Mistral-Small-24B-Instruct-2501-Q4_K_M.gguf",
      "provider": "llamacpp",
      "numRuns": 3,
      "avgTps": 5.22,
      "minTps": 5.14,
      "maxTps": 5.31,
      "avgTtftMs": null,
      "avgTotalMs": 41391.69,
      "avgOutputTokens": 216.0
    }
  ]
}
